"journal-article-10.2307_41443027-ngram1.txt","Hasidic Landmarks in Present-day Poland"
"journal-article-10.2307_41443223-ngram1.txt","Jews in the New Germany—What Has Changed?"
"journal-article-10.2307_42751118-ngram1.txt","POWER AND AUTHORITY IN THE RELIGIOUS TRADITIONS: A PROTESTANT PERSPECTIVE"
"journal-article-10.2307_41442663-ngram1.txt","Jewish Survival"
"journal-article-10.2307_41443489-ngram1.txt","QUESTIONS TO THE MILLENNIUM: 2000, 5760, 1420"
"journal-article-10.2307_41443513-ngram1.txt","ANDRÉ NEHER'S READING OF THE BOOK OF AMOS"
"journal-article-10.2307_41444262-ngram1.txt","Zionism and Israel"
"journal-article-10.2307_42751053-ngram1.txt","THE INTEGRITY OF JOHN RAYNER AND INTER-FAITH RELATIONS"
"journal-article-10.2307_42751117-ngram1.txt","POSITIONS OF JEWISH LEADERSHIP: SOURCES OF AUTHORITY AND POWER"
"journal-article-10.2307_43740574-ngram1.txt","WAR AS A CHALLENGE TO OUR RELIGIOUS TRADITIONS: A Muslim Response"
"journal-article-10.2307_43740667-ngram1.txt","FROM BIBLE TO BERLIN (IRVING): The Message of Jewish Popular Song"
"journal-article-10.2307_43740670-ngram1.txt","THE CONCEPT OF PHILOSOPHY IN THE SIXTEENTH CENTURY: Leone Ebreo and the Italian Renaissance"
"journal-article-10.2307_41431165-ngram1.txt","JEWISH-CHRISTIAN RELATIONS IN POLAND: A Personal Reflection"
"journal-article-10.2307_41431167-ngram1.txt","A SEMINAR IN AUSCHWITZ-BIRKENAU: Some Personal Reflections"
"journal-article-10.2307_41443141-ngram1.txt","Jewish Theology and Political Empowerment"
"journal-article-10.2307_41443418-ngram1.txt","IGNAZ MAYBAUM: AN APPRECIATION"
"journal-article-10.2307_41443621-ngram1.txt","THERAPY IS A PROCESS THAT REDUCES INJUSTICE"
"journal-article-10.2307_41444193-ngram1.txt","Amsterdam: Hebrew Printing"
"journal-article-10.2307_43740607-ngram1.txt","TO REMEMBER AND TO FORGET - JERUSALEM IN JEWISH POETICAL MEMORY"
"journal-article-10.2307_43744027-ngram1.txt","IMAGINING MULTICULTURAL LONDON: CONTAINMENT AND EXCESS IN \"SNATCH\""
"journal-article-10.2307_41431093-ngram1.txt","Poetry and Violence"
"journal-article-10.2307_41442256-ngram1.txt","Sephardim and Ashkenazim"
"journal-article-10.2307_41442723-ngram1.txt","Some Notes on Biblical Ideas About Language: An Anthropological Perspective"
"journal-article-10.2307_41443112-ngram1.txt","Prayerbook Reform in Europe Since 1966 as seen by Jakob J. Petuchowski (1925-1991)"
"journal-article-10.2307_41443416-ngram1.txt","'GOD IS THY RESCUE' AS THE CENTRAL MESSAGE OF THE \"SEDER\" RITUAL: The Midrash on Devarim 26 in its Biblical Context"
"journal-article-10.2307_41443446-ngram1.txt","SKIN AND BONE, SPIRIT AND SELF: INTERPRETING EZEKIEL'S VISION"
"journal-article-10.2307_41443612-ngram1.txt","CULTURE AND THE NEW INTERNATIONAL ORDER"
"journal-article-10.2307_41443841-ngram1.txt","FORTY YEARS OF 'JUDAISM AND PSYCHOTHERAPY': AN OVERVIEW"
"journal-article-10.2307_41444102-ngram1.txt","SEPHARDIC SONGS OF MOURNING AND DIRGES"
"journal-article-10.2307_41444465-ngram1.txt","ARE WE PRISONERS OF OUR HISTORY?"
"journal-article-10.2307_41444492-ngram1.txt","PSYCHOTHERAPY AND THE 'JEWISH EXPERIENCE'"
"journal-article-10.2307_42751056-ngram1.txt","'...AND A NEW SPIRIT I WILL PUT WITHIN YOU': THE CONTRIBUTION OF RABBI JOHN D. RAYNER TO THE CREATION OF LIBERAL PRAYER BOOKS"
"journal-article-10.2307_42751092-ngram1.txt","THE JEWS OF CORNWALL REVISITED"
"journal-article-10.2307_43740641-ngram1.txt","BALANCE IN THE ECOSPHERE: A PERSPECTIVE"
"journal-article-10.2307_43740695-ngram1.txt","THE AWARD OF AN HONORARY DOCTORATE TO RABBI ERNST STEIN BY THE HUMBOLDT UNIVERSITY, BERLIN"
"journal-article-10.2307_41442228-ngram1.txt","Organized Decline"
"journal-article-10.2307_41442616-ngram1.txt","My Teacher Buber"
"journal-article-10.2307_41442664-ngram1.txt","British Zionistic Writings Revisited"
"journal-article-10.2307_41442734-ngram1.txt","[Report from Germany:] Dialogue: Notes on a Presentation to the Annual Meeting of the American Jewish Committee New York, May 12-16, 1982"
"journal-article-10.2307_41442931-ngram1.txt","A Jewish Response to the Lecture on Women's Experiences of Belief"
"journal-article-10.2307_41443616-ngram1.txt","THE JEWISH INTELLECTUAL IN FRANCE: DURKHEIM AND MAUSS"
"journal-article-10.2307_41443660-ngram1.txt","PRIVATE CONSCIENCE: PUBLIC DUTY"
"journal-article-10.2307_41443754-ngram1.txt","WHAT WAS LOST? THE CZECH JEWISH COMMUNITY"
"journal-article-10.2307_41443879-ngram1.txt","'IN ITS TIME I WILL HASTEN IT': MESSIANIC SPECULATION IN THE BABYLONIAN TALMUD, SANHEDRIN 96B-99A"
"journal-article-10.2307_41443973-ngram1.txt","THE BOOK OF LEVITICUS: WHAT ARE THIS BOOK'S IMPLICATIONS FOR TODAY'S (POLITICAL) THINKING"
"journal-article-10.2307_41444278-ngram1.txt","The Moral Philosopher's View on the Holocaust"
"journal-article-10.2307_41444281-ngram1.txt","The Unwilling Midwife-Ernest Bevin and the Birth of Israel"
"journal-article-10.2307_41444627-ngram1.txt","AN OPEN LETTER: A CALL TO PEACE, DIALOGUE AND UNDERSTANDING BETWEEN MUSLIMS AND JEWS"
"journal-article-10.2307_41444643-ngram1.txt","'GO ARGUE WITH TODAY'S CHILDREN': THE JEWISH FAMILY IN SHOLEM ALEICHEM AND VLADIMIR JABOTINSKY"
"journal-article-10.2307_42751098-ngram1.txt","journal-article-10.2307_42751098-ngram1.txt"
"journal-article-10.2307_42751210-ngram1.txt","'NO ROOM FOR TRUTH': ON THE PRECARIOUSNESS OF LIFE AND NARRATIVE IN \"THE LAST OF THE JUST\""
"journal-article-10.2307_41432744-ngram1.txt","Heroes or Victims? The Role and Antifascist Culture of Jews in the German Democratic Republic"
"journal-article-10.2307_41442188-ngram1.txt","Jewish Destiny in Contemperary Israeli Literature"
"journal-article-10.2307_41442439-ngram1.txt","Ten Years after the Kafka Symposium of Liblice"
"journal-article-10.2307_41442560-ngram1.txt","The Wisdom of Insecurity On the Role of Progressive Judaism Today"
"journal-article-10.2307_41442623-ngram1.txt","Martin Buber and Orthodox Judaism — Some Reflections"
"journal-article-10.2307_41442817-ngram1.txt","Kiddush Ha-Shem"
"journal-article-10.2307_41443005-ngram1.txt","Paradoxes of Exile"
"journal-article-10.2307_41443994-ngram1.txt","journal-article-10.2307_41443994-ngram1.txt"
"journal-article-10.2307_41444416-ngram1.txt","Human Aspiration, the Lessons of a Century"
"journal-article-10.2307_42751119-ngram1.txt","POWER AND AUTHORITY IN RELIGIOUS TRADITIONS IN ISLAM: Reflections about issues of power and authority in the traditions and the present situation of Muslims in Europe"
"journal-article-10.2307_43740513-ngram1.txt","Pnina Navé-Levinson"
"journal-article-10.2307_43740606-ngram1.txt","THE STORY OF THE SEVEN GATES: VISIBLE BODIES, INVISIBLE BODIES AND LOST SOULS"
"journal-article-10.2307_43740633-ngram1.txt","DAS IST NICHT NUR GESTERN; DAS IST MORGEN UND HEUTE (It is not only yesterday, it is tomorrow and today)"
"journal-article-10.2307_43744099-ngram1.txt","Le Judaïsme de France 1967"
"journal-article-10.2307_41442440-ngram1.txt","Kafka's Judaism"
"journal-article-10.2307_41442528-ngram1.txt","For an Alternative Judaism"
"journal-article-10.2307_41443137-ngram1.txt","On Jeremiah and the Poetics of (Prophetic?) Pornography"
"journal-article-10.2307_41443787-ngram1.txt","WHO IS A JEW: HALACHA, LAWS AND POLITICS"
"journal-article-10.2307_41443843-ngram1.txt","FORTY YEARS OF EUROPEAN JUDAISM – THIRTY EIGHT YEARS OF DIALOGUE"
"journal-article-10.2307_41443847-ngram1.txt","RABBI DR MAYBAUM AND RABBI DR BAECK: A FOOTNOTE TO PROFESSOR DAVID ELLENSON'S LECTURE"
"journal-article-10.2307_41444342-ngram1.txt","Routes to Jewish Salvation or Sanity?"
"journal-article-10.2307_42751055-ngram1.txt","'HE DID BESTRIDE OUR NARROW WORLD LIKE A COLOSSUS'"
"journal-article-10.2307_42751121-ngram1.txt","THE CHURCHES AND THEIR SOCIAL RESPONSIBILITY. A CHRISTIAN PERSPECTIVE"
"journal-article-10.2307_43740701-ngram1.txt","A NOACHIDE PROFILE"
"journal-article-10.2307_41431170-ngram1.txt","Judaism in Modern Hungary: The Example of Sim Shalom Community Budapest"
"journal-article-10.2307_41442333-ngram1.txt","The Flight from Chaos"
"journal-article-10.2307_41442937-ngram1.txt","The Binding of Isaac"
"journal-article-10.2307_41442988-ngram1.txt","\"In The Beginning\": Chaos, Creation and Therapy"
"journal-article-10.2307_41443115-ngram1.txt","A Therapist's Response to \"A Limited God\""
"journal-article-10.2307_41444081-ngram1.txt","THE DETECTIVE NOVEL IN LADINO: CLUES TO A LITTLE KNOWN GENRE"
"journal-article-10.2307_41444202-ngram1.txt","Jews in Post-Holocaust Germany"
"journal-article-10.2307_41444421-ngram1.txt","What is Our Strength and Our Endurance?"
"journal-article-10.2307_43740580-ngram1.txt","ISLAM AND COMMUNAL PLURALISM"
"journal-article-10.2307_43744029-ngram1.txt","OF SHADOW-PLAY AND PROMISED LANDS: BETWEEN AMERICA AND ISRAEL: INTERVIEW WITH CLIVE SINCLAIR"
"journal-article-10.2307_43744075-ngram1.txt","Jews and Science: A Rabbi's View"
"journal-article-10.2307_41442413-ngram1.txt","The Path of Return—A Preface to the Reading of Rosenzweig"
"journal-article-10.2307_41442785-ngram1.txt","An Interpretation of \"Mr Eliot's Sunday Morning Service\""
"journal-article-10.2307_41443514-ngram1.txt","LEO BAECK: THE TEACHER"
"journal-article-10.2307_41443592-ngram1.txt","THE SEVENTY-FIFTH ANNIVERSARY OF THE WORLD UNION FOR PROGRESSIVE JUDAISM"
"journal-article-10.2307_41443974-ngram1.txt","JEWISH PREACHING ON LEVITICUS"
"journal-article-10.2307_41444012-ngram1.txt","THE LIBRARY OF THE ISRAELITISCHE CULTUSGEMEINDE ZÜRICH (ICZ)"
"journal-article-10.2307_41444160-ngram1.txt","'The Inner Whirlwind': A Review on the book of Job"
"journal-article-10.2307_41444275-ngram1.txt","In Memory of Spinoza"
"journal-article-10.2307_41444396-ngram1.txt","Anti-Semitism and Anti-Zionism in Latin America: Analysis and Response"
"journal-article-10.2307_41444545-ngram1.txt","GERMAN JEWISH HERITAGE AND GERMAN ATTITUDES"
"journal-article-10.2307_41444585-ngram1.txt","INTERRELIGIOUS DIALOGUE IN CONFLICT SITUATIONS"
"journal-article-10.2307_42751226-ngram1.txt","journal-article-10.2307_42751226-ngram1.txt"
"journal-article-10.2307_43740520-ngram1.txt","Majority Discrimination"
"journal-article-10.2307_41431060-ngram1.txt","THE SEPHARDIC VOICE OF ELIAS CANETTI"
"journal-article-10.2307_41431086-ngram1.txt","Italo Svevo"
"journal-article-10.2307_41442392-ngram1.txt","From Kladow to St. John's Wood"
"journal-article-10.2307_41442415-ngram1.txt","The Daemonic in Religion"
"journal-article-10.2307_41442489-ngram1.txt","Kafka's Ape: A Meditation on Religious Dialogue"
"journal-article-10.2307_41442490-ngram1.txt","Trialogue—Jews in the New Europe"
"journal-article-10.2307_41442696-ngram1.txt","Levy's New Last Will and Testament"
"journal-article-10.2307_41442843-ngram1.txt","\"New York - City of Exile\""
"journal-article-10.2307_41443222-ngram1.txt","Nazis Go to Town: Reflections on German-Jewish Life Today"
"journal-article-10.2307_41443583-ngram1.txt","THE SANE PERSON WITHIN"
"journal-article-10.2307_41443727-ngram1.txt","FIFTY YEARS OF THE \"JEWISH QUARTERLY\""
"journal-article-10.2307_41443808-ngram1.txt","ADDRESS GIVEN AT THE WEST LONDON SYNAGOGUE ON THE OCCASION OF THE INAUGURATION OF THE JEWISH THEOLOGICAL COLLEGE OF THE ASSOCIATION OF SYNAGOGUES IN GREAT BRITAIN, ON 30 SEPTEMBER 1956"
"journal-article-10.2307_41443842-ngram1.txt","MEDITATIONS ON CONVERSATIONS ..."
"journal-article-10.2307_41444419-ngram1.txt","\"What Is Our Life?\""
"journal-article-10.2307_41444460-ngram1.txt","ARCHITECT AND COMMUNITY IN THE YEAR 2000"
"journal-article-10.2307_41444463-ngram1.txt","IDENTITY, INESCAPE AND INWAYWARDNESS"
"journal-article-10.2307_41444578-ngram1.txt","EDUCATION WITHIN OUR FAITH COMMUNITIES: WHAT DO WE LEARN AND WHAT DO WE TEACH ABOUT OURSELVES AND ABOUT OTHERS?"
"journal-article-10.2307_43740582-ngram1.txt","RESPONDING TO TRAUMA AND LOSS IN A DIVIDED LAND: Links with Palestinian Mental Health Workers"
"journal-article-10.2307_43740632-ngram1.txt","AGEING PATIENTS, PSYCHOTHERAPISTS AND HOLOCAUST SURVIVORS"
"journal-article-10.2307_41431162-ngram1.txt","THE SCULPTOR AND THE PAINTER: Two Russian-Jewish Artists"
"journal-article-10.2307_41442239-ngram1.txt","Agnon and Kafka"
"journal-article-10.2307_41442254-ngram1.txt","Italian Jewry Today"
"journal-article-10.2307_41442395-ngram1.txt","A Reply to Ellis Rivkin"
"journal-article-10.2307_41442493-ngram1.txt","American Impressions"
"journal-article-10.2307_41443011-ngram1.txt","Anglo-Jewry"
"journal-article-10.2307_41443483-ngram1.txt","ISSUES SURROUNDING THE DEVELOPMENT OF THE NEO-NAZI SCENE IN EAST BERLIN"
"journal-article-10.2307_41443786-ngram1.txt","THE CHALLENGE OF LIVING WITH MULTIPLE IDENTITIES: 'DOES MONOTHEISM BREED MONOMANIA?'"
"journal-article-10.2307_41443905-ngram1.txt","IN HIDING? THE JEWS OF EUROPE"
"journal-article-10.2307_41443965-ngram1.txt","THE GROWTH OF THE HEBRAICA/JUDAICA COLLECTIONS AT THE SCHOOL OF ORIENTAL AND AFRICAN STUDIES LIBRARY TO 2008"
"journal-article-10.2307_41443968-ngram1.txt","BATTLE FOR THREE BOOKS"
"journal-article-10.2307_41443970-ngram1.txt","EUROPEAN DIVERSITY, RELIGION AND CITIZENSHIP"
"journal-article-10.2307_41444002-ngram1.txt","UNTIMELY CHILDHOOD IN LITERARY HOLOCAUST MEMOIRS AND NOVELS FOR THE YOUNG"
"journal-article-10.2307_41444003-ngram1.txt","TRANSMITTED HOLOCAUST TRAUMA: A MATTER OF MYTH AND FAIRY TALES?"
"journal-article-10.2307_41444007-ngram1.txt","JEWS AND OTHER EUROPEANS, OLD AND NEW"
"journal-article-10.2307_41444582-ngram1.txt","THE RELIGIOUS CHALLENGE OF LIVING BETWEEN CULTURES"
"journal-article-10.2307_41444623-ngram1.txt","MODELS OF RELIGIOUS COEXISTENCE: A MUSLIM PERSPECTIVE"
"journal-article-10.2307_43740572-ngram1.txt","WAR AS A CHALLENGE TO OUR RELIGIOUS TRADITIONS: A Jewish Response"
"journal-article-10.2307_43744023-ngram1.txt","FETISHIZING THE HOLOCAUST: COMEDY AND TRANSATLANTIC CONNECTIONS IN HOWARD JACOBSON'S \"KALOOKI NIGHTS\""
"journal-article-10.2307_41431062-ngram1.txt","'THE FACE AS A BATTLEFIELD' BY YGAL BURSZTYN"
"journal-article-10.2307_41443216-ngram1.txt","The Return of Fascism: Some Psychological Aspects"
"journal-article-10.2307_41443387-ngram1.txt","THE URGENCY OF A JEWISH RESPONSE IN THE INTERRELIGIOUS DIALOGUE"
"journal-article-10.2307_41443725-ngram1.txt","PUBLISHING AS MISSION"
"journal-article-10.2307_41444277-ngram1.txt","Samuel David Luzzatto—The Dilemma of a conservative Jew"
"journal-article-10.2307_41444317-ngram1.txt","The Misuses of the Holocaust"
"journal-article-10.2307_41444458-ngram1.txt","LIBERATION AND REDEMPTION: THEIR MEANING TODAY"
"journal-article-10.2307_41444580-ngram1.txt","THE RELIGIOUS CHALLENGE OF LIVING BETWEEN CULTURES"
"journal-article-10.2307_41444587-ngram1.txt","DIALOGUE? THANK YOU, NO! TEN COMMANDMENTS FOR INTERFAITH DIALOGUE"
"journal-article-10.2307_41444642-ngram1.txt","THE SHTETL IN NEW YORK: THE POET MALKA LEE"
"journal-article-10.2307_41442417-ngram1.txt","Walter Rathenau's 'Höre Israel' and its Jewish critics"
"journal-article-10.2307_41442595-ngram1.txt","Biblical Dimensions in the Work of Elie Wiesel"
"journal-article-10.2307_41442598-ngram1.txt","Keri U'chtiv: Of a Shabbat in Budapest"
"journal-article-10.2307_41442819-ngram1.txt","The Way of the Lily or Solomon Speaks to the Animals"
"journal-article-10.2307_41443024-ngram1.txt","The Hidden Legacy"
"journal-article-10.2307_41443109-ngram1.txt","To Whom Shall We Give Access to Our Water-holes?"
"journal-article-10.2307_41443440-ngram1.txt","ESTHER POLITICISED IN A PERSONAL CONTEXT: SOME REMARKS ON FOREIGNNESS"
"journal-article-10.2307_41443481-ngram1.txt","GERMANY, MY GERMANY"
"journal-article-10.2307_41443728-ngram1.txt","THE POWER OF LETTERS – MAPPING OUT A JUDAISM FOR TODAY WITH AN EDITORIAL MASTERPLAN"
"journal-article-10.2307_41443750-ngram1.txt","WARD SEVEN"
"journal-article-10.2307_41443755-ngram1.txt","MEMORIAL SCROLLS TRUST"
"journal-article-10.2307_41443811-ngram1.txt","LEARNING, TEACHING, BEING"
"journal-article-10.2307_41443844-ngram1.txt","OPENING ADDRESS"
"journal-article-10.2307_41444106-ngram1.txt","MIGRATION IN THE TWENTIETH-CENTURY SEPHARDIC SONG REPERTOIRE"
"journal-article-10.2307_41444144-ngram1.txt","Franz Rosenzweig: The Path of Return"
"journal-article-10.2307_41444180-ngram1.txt","Bibliography Ignaz Maybaum"
"journal-article-10.2307_41444183-ngram1.txt","From Exile to Assimilation"
"journal-article-10.2307_41444343-ngram1.txt","Personal Advice for Jewish People"
"journal-article-10.2307_41444394-ngram1.txt","The Diaspora in the 21st Century – Our Future"
"journal-article-10.2307_41444498-ngram1.txt","THE JEWISH MOTHER: Is That Why so Many of us Become Counsellors?"
"journal-article-10.2307_41444503-ngram1.txt","REACTIONS TO THE ASSASSINATION OF PRIME MINISTER YITZHAK RABIN"
"journal-article-10.2307_43740700-ngram1.txt","'THEIR HEARTS MELTED AND BECAME AS WATER.' LAMENTATIONS: ETHICS AFTER AUSCHWITZ"
"journal-article-10.2307_43744035-ngram1.txt","journal-article-10.2307_43744035-ngram1.txt"
"journal-article-10.2307_41431116-ngram1.txt","A Brief Clinical Vignette"
"journal-article-10.2307_41432747-ngram1.txt","Responses to the Shoah: The Search for Meaning"
"journal-article-10.2307_41442232-ngram1.txt","Freedom and Wit, The Jewish Writer and Modern Art"
"journal-article-10.2307_41442495-ngram1.txt","Joseph Roth: The Poet Of Silence"
"journal-article-10.2307_41442590-ngram1.txt","French Jewry - A Very Personal View"
"journal-article-10.2307_41442597-ngram1.txt","An Interview with Theo Tobiasse"
"journal-article-10.2307_41442702-ngram1.txt","journal-article-10.2307_41442702-ngram1.txt"
"journal-article-10.2307_41442791-ngram1.txt","Megillat Ha - Shoah"
"journal-article-10.2307_41443110-ngram1.txt","Inertia"
"journal-article-10.2307_41443646-ngram1.txt","EDITORIAL"
"journal-article-10.2307_41443840-ngram1.txt","TO BE EUROPEAN OR NOT, THAT IS MY QUESTION"
"journal-article-10.2307_41443902-ngram1.txt","THE MORAL IMAGINATION: THE ART AND SOUL OF BUILDING PEACE: ASSOCIATION OF CONFLICT RESOLUTION SACRAMENTO, SEPTEMBER 30, 2004"
"journal-article-10.2307_41443959-ngram1.txt","THE LIBRARY OF THE ISRAELITISCHE CULTUSGEMEINDE ZÜRICH (ICZ)"
"journal-article-10.2307_41444285-ngram1.txt","The coming into being of an Author"
"journal-article-10.2307_41444461-ngram1.txt","THE TRANSMISSION OF HOLOCAUST TRAUMATA: A discussion of Anita Brookner's novel \"Latecomers\""
"journal-article-10.2307_41444616-ngram1.txt","BE BOLDER AS RABBIS"
"journal-article-10.2307_41444622-ngram1.txt","A JEWISH PERSPECTIVE"
"journal-article-10.2307_41444660-ngram1.txt","Back Matter"
"journal-article-10.2307_42751057-ngram1.txt","JOHN RAYNER AS PREACHER: THE SERMON IN RESPONSE TO HISTORICAL EVENTS"
"journal-article-10.2307_42751120-ngram1.txt","RELIGIONS AND CIVIL SOCIETY: A JEWISH PERSPECTIVE"
"journal-article-10.2307_43744096-ngram1.txt","Jean François Steiner and the Holocaust An Interview with Goulston and Friedlander"
"journal-article-10.2307_41431049-ngram1.txt","A MINORITY WITHIN A MINORITY: REFLECTIONS ON SEPHARDI IDENTITY"
"journal-article-10.2307_41431063-ngram1.txt","PAUL CELAN: THIRTY YEARS LATER"
"journal-article-10.2307_41442396-ngram1.txt","The Israeli Writer and the Holocaust"
"journal-article-10.2307_41442591-ngram1.txt","French Jewry - Its Political Reactions"
"journal-article-10.2307_41442629-ngram1.txt","Comic Echoes of Kafka"
"journal-article-10.2307_41442722-ngram1.txt","The Irreducible Word"
"journal-article-10.2307_41443004-ngram1.txt","Brotherhood Week Sermon, Koblenz, March 1989"
"journal-article-10.2307_41443113-ngram1.txt","Zionism"
"journal-article-10.2307_41443411-ngram1.txt","ALBERT HOSCHANDER FRIEDLANDER PROFILE: Curriculum Vitae and Partial Bibliography"
"journal-article-10.2307_41443748-ngram1.txt","EDITORIAL"
"journal-article-10.2307_41443791-ngram1.txt","WHY WAS JERUSALEM DESTROYED?"
"journal-article-10.2307_41443818-ngram1.txt","MEMOIR OF LEO BAECK COLLEGE"
"journal-article-10.2307_41444393-ngram1.txt","Czechoslovakian Jewry Today"
"journal-article-10.2307_41444462-ngram1.txt","THE POETRY OF EXILE"
"journal-article-10.2307_41444472-ngram1.txt","THE CHALLENGE OF INTERFAITH"
"journal-article-10.2307_41444611-ngram1.txt","EDITORIAL"
"journal-article-10.2307_43744079-ngram1.txt","Eugene Heimler: In Memoriam"
"journal-article-10.2307_43744088-ngram1.txt","Letters to the Editor"
"journal-article-10.2307_41442176-ngram1.txt","Religion in the Affluent Society"
"journal-article-10.2307_41442178-ngram1.txt","The Other Europe"
"journal-article-10.2307_41442242-ngram1.txt","Religion and Culture in Eastern Europe"
"journal-article-10.2307_41442278-ngram1.txt","Paul Celan"
"journal-article-10.2307_41442571-ngram1.txt","INDEX EUROPEAN JUDAISM: Volume VIII, No. 2 - Volume XI, No. 1 1974 - 1977"
"journal-article-10.2307_41442645-ngram1.txt","A Psychologist looks at Sin, guilt, atonement and reconciliation"
"journal-article-10.2307_41442786-ngram1.txt","Kafka and Orwell - against Prophecy"
"journal-article-10.2307_41442859-ngram1.txt","Leo Baeck College at Thirty"
"journal-article-10.2307_41442930-ngram1.txt","Women's Experience of Belief - Résumé"
"journal-article-10.2307_41443251-ngram1.txt","ROMAIN GARY AND THE HOLOCAUST"
"journal-article-10.2307_41443618-ngram1.txt","THE TORTURER'S HORSE: WHAT KINDS OF WITNESS DOES LITERATURE BEAR?"
"journal-article-10.2307_41443812-ngram1.txt","MY STUDENT YEARS AT LEO BAECK COLLEGE"
"journal-article-10.2307_41444244-ngram1.txt","journal-article-10.2307_41444244-ngram1.txt"
"journal-article-10.2307_42751138-ngram1.txt","OUT OF EXILE: SOME THOUGHTS ON EXILE AS A DYNAMIC CONDITION"
"journal-article-10.2307_43744033-ngram1.txt","AN INTERVIEW WITH ESTHER BENDAHAN"
"journal-article-10.2307_41431155-ngram1.txt","CZELADZ, BERLIN AND WHITECHAPEL: The World of Avrom Nokhem Stencl"
"journal-article-10.2307_41442457-ngram1.txt","The New Paradigm of Europe"
"journal-article-10.2307_41442468-ngram1.txt","The Song of Songs"
"journal-article-10.2307_41442543-ngram1.txt","Man's Confrontation with Tragedy"
"journal-article-10.2307_41442724-ngram1.txt","Why the figure of Honi the Circle-Drawer in Jewish legend resembles that of Moshe our Teacher"
"journal-article-10.2307_41442789-ngram1.txt","London Report: The Enigmatic Variations of Roman Vishniac"
"journal-article-10.2307_41442881-ngram1.txt","Letter from Paris"
"journal-article-10.2307_41443142-ngram1.txt","The Challenge of Jewish Empowerment: Is The Answer Theological?"
"journal-article-10.2307_41443254-ngram1.txt","CHURCH AND CONFLICT IN THE PROCESS OF PASTORAL TRAINING"
"journal-article-10.2307_41443749-ngram1.txt","TRUTH AND FICTION: THE HOLOCAUST ON STAGE AND SCREEN"
"journal-article-10.2307_41443821-ngram1.txt","MY EXPERIENCE AS STUDENT AND LECTURER AT LEO BAECK COLLEGE"
"journal-article-10.2307_41444499-ngram1.txt","THE ADOPTION TRIANGLE"
"journal-article-10.2307_42751115-ngram1.txt","USE AND ABUSE OF RELIGIOUS LANGUAGE - A JEWISH VIEW"
"journal-article-10.2307_43740581-ngram1.txt","THE 100TH ANNIVERSARY THEODOR HERZL CONFERENCE: Held at the Stadtcasino Basel (Congress Hall) 27-30 August 1997"
"journal-article-10.2307_43744074-ngram1.txt","Jews and Science: The Lame Versus the Blind?"
"journal-article-10.2307_41442420-ngram1.txt","Who are the Living and who are the Dead? (The poetry of Abba Kovner)"
"journal-article-10.2307_41442542-ngram1.txt","Ten Years of European Judaism"
"journal-article-10.2307_41442945-ngram1.txt","Memories Without Hate: Kaufmann Memorial Lecture"
"journal-article-10.2307_41443217-ngram1.txt","Polities and Xenophobia"
"journal-article-10.2307_41443272-ngram1.txt","journal-article-10.2307_41443272-ngram1.txt"
"journal-article-10.2307_41443371-ngram1.txt","THE LEO BAECK COLLEGE"
"journal-article-10.2307_41443470-ngram1.txt","journal-article-10.2307_41443470-ngram1.txt"
"journal-article-10.2307_41443582-ngram1.txt","MEDIA, THE INTIFADA AND THE AFTERMATH OF SEPTEMBER 11"
"journal-article-10.2307_41443590-ngram1.txt","A TRIBUTE"
"journal-article-10.2307_41443960-ngram1.txt","THE HEBREW COLLECTION OF THE BERLIN STATE LIBRARY"
"journal-article-10.2307_41444231-ngram1.txt","Unstable Margins"
"journal-article-10.2307_41444295-ngram1.txt","Bonhoeffer and Baeck: Theology after Auschwitz"
"journal-article-10.2307_41444395-ngram1.txt","The Diaspora in the 21st Century – Latin America"
"journal-article-10.2307_41444413-ngram1.txt","Politics and Religion"
"journal-article-10.2307_41444583-ngram1.txt","HOW DO CONFLICT SITUATIONS AFFECT OUR FAITH COMMUNITIES AND OUR INTERRELIGIOUS RELATIONSHIPS?"
"journal-article-10.2307_42751125-ngram1.txt","YOUNG, GIFTED AND RELIGIOUS: WHAT DO WE EXPECT FROM OUR TRADITION AND OUR SOCIETY?"
"journal-article-10.2307_43740706-ngram1.txt","journal-article-10.2307_43740706-ngram1.txt"
"journal-article-10.2307_43744071-ngram1.txt","Introduction"
"journal-article-10.2307_41431184-ngram1.txt","journal-article-10.2307_41431184-ngram1.txt"
"journal-article-10.2307_41442389-ngram1.txt","The Book of the Absent: Third Part"
"journal-article-10.2307_41442425-ngram1.txt","journal-article-10.2307_41442425-ngram1.txt"
"journal-article-10.2307_41442441-ngram1.txt","A Kafka Legacy"
"journal-article-10.2307_41442544-ngram1.txt","Hitler and History/The Jews of Paris"
"journal-article-10.2307_41442561-ngram1.txt","The Onward Journey Concerning the Problem of Identity: Psalm 139"
"journal-article-10.2307_41442647-ngram1.txt","After the Kirchentag: Problems of Guilt and Atonement"
"journal-article-10.2307_41442725-ngram1.txt","Technological Change and Ancient Israel"
"journal-article-10.2307_41442735-ngram1.txt","Unveiling a Synagogue Monument in Germany"
"journal-article-10.2307_41442813-ngram1.txt","Extracts from a New Play: \"I saw the Swede\""
"journal-article-10.2307_41442865-ngram1.txt","College Students - Then and Now"
